{
  "$schema": "https://json-schema.org/draft/2020-12/schema",
  "$id": "urn:osahi:schema:v0.1:agent-run",
  "title": "AgentRun",
  "type": "object",
  "additionalProperties": false,
  "required": [
    "run_id",
    "spec_version",
    "status",
    "model",
    "workload",
    "harness",
    "created_at",
    "parent_run_id",
    "metadata"
  ],
  "properties": {
    "run_id": { "type": "string", "minLength": 1 },
    "spec_version": { "const": "0.1.0" },
    "status": {
      "enum": ["created", "running", "paused", "completed", "failed", "cancelled"]
    },
    "model": { "$ref": "#/$defs/model" },
    "workload": { "$ref": "#/$defs/workload" },
    "harness": { "$ref": "#/$defs/harness" },
    "created_at": { "$ref": "#/$defs/timestamp" },
    "parent_run_id": { "type": ["string", "null"] },
    "metadata": { "type": "object" }
  },
  "$defs": {
    "timestamp": {
      "type": "string",
      "pattern": "^[0-9]{4}-[0-9]{2}-[0-9]{2}T[0-9]{2}:[0-9]{2}:[0-9]{2}Z$"
    },
    "model": {
      "type": "object",
      "additionalProperties": false,
      "required": ["provider", "name"],
      "properties": {
        "provider": { "type": "string", "minLength": 1 },
        "name": { "type": "string", "minLength": 1 }
      }
    },
    "workload": {
      "type": "object",
      "additionalProperties": false,
      "required": ["id", "name"],
      "properties": {
        "id": { "type": "string", "minLength": 1 },
        "name": { "type": "string", "minLength": 1 }
      }
    },
    "harness": {
      "type": "object",
      "additionalProperties": false,
      "required": ["name", "version"],
      "properties": {
        "name": { "type": "string", "minLength": 1 },
        "version": { "type": "string", "minLength": 1 }
      }
    }
  }
}
